{
  "schema_version": 2,
  "run_id": "20261012-181926899-8b2b738",
  "run_kind": "nightly",
  "skill": "defend-the-diff",
  "status": "completed",
  "passed": false,
  "metrics": {
    "pass_rate": 0,
    "mean_score": 0.4166666666666667,
    "pass_at_k": 0,
    "pass_to_k": 0,
    "flaky_count": 0,
    "tokens": 1633605,
    "turns": 102,
    "tool_calls": 209,
    "wall_time_ms": 1597223
  },
  "stimuli": [
    {
      "name": "defend-the-diff--pagination-change",
      "score": {
        "aggregateScore": 0.09999999999999999,
        "multiTrial": {
          "passAtK": 0,
          "passToTheK": 0
        },
        "flaky": false
      }
    },
    {
      "name": "defend-the-diff--documentation-only-change",
      "score": {
        "aggregateScore": 0.6000000000000001,
        "multiTrial": {
          "passAtK": 0,
          "passToTheK": 0
        },
        "flaky": false
      }
    },
    {
      "name": "defend-the-diff--refund-event-handler",
      "score": {
        "aggregateScore": 0.55,
        "multiTrial": {
          "passAtK": 0,
          "passToTheK": 0
        },
        "flaky": false
      }
    }
  ],
  "trials": [
    {
      "evalName": "defend-the-diff",
      "stimulus": "defend-the-diff--documentation-only-change",
      "passed": false,
      "score": 0.6666666666666666,
      "durationMs": 61955,
      "metrics": {
        "tokens": 67807,
        "turns": 5,
        "tool_calls": 5,
        "wall_time_ms": 61955
      },
      "graders": [
        {
          "name": "prompt",
          "passed": true,
          "score": 1,
          "evidence": "The agent delivered a strict, evidence-based review aligned with the requested stance: it identified a pure documentation typo fix, confirmed no behavioral change, and appropriately avoided requesting unnecessary follow-up work."
        },
        {
          "name": "skill-invocation requires defend-the-di…",
          "passed": false,
          "score": 0,
          "evidence": "The following required skills were not called: defend-the-diff\nNo disallowed skills were called"
        },
        {
          "name": "diff-empty",
          "passed": true,
          "score": 1,
          "evidence": "Workspace diff is empty"
        }
      ]
    },
    {
      "evalName": "defend-the-diff",
      "stimulus": "defend-the-diff--documentation-only-change",
      "passed": false,
      "score": 0.5833333333333334,
      "durationMs": 62789,
      "metrics": {
        "tokens": 54365,
        "turns": 4,
        "tool_calls": 5,
        "wall_time_ms": 62789
      },
      "graders": [
        {
          "name": "prompt",
          "passed": false,
          "score": 0.75,
          "evidence": "Strong evaluation: accurate identification of a documentation-only typo fix, correct no-behavior-impact conclusion, and appropriately concise coverage. Minor deduction for not explicitly covering all 'no additional X' categories (test/refactor) and for introducing a small optional-note caveat."
        },
        {
          "name": "skill-invocation requires defend-the-di…",
          "passed": false,
          "score": 0,
          "evidence": "The following required skills were not called: defend-the-diff\nNo disallowed skills were called"
        },
        {
          "name": "diff-empty",
          "passed": true,
          "score": 1,
          "evidence": "Workspace diff is empty"
        }
      ]
    },
    {
      "evalName": "defend-the-diff",
      "stimulus": "defend-the-diff--documentation-only-change",
      "passed": false,
      "score": 0.5833333333333334,
      "durationMs": 63124,
      "metrics": {
        "tokens": 55103,
        "turns": 4,
        "tool_calls": 6,
        "wall_time_ms": 63124
      },
      "graders": [
        {
          "name": "prompt",
          "passed": false,
          "score": 0.75,
          "evidence": "Strong evaluation: it correctly identifies a harmless documentation typo fix, confirms no behavioral impact, and recommends approval without code changes. Minor hedging about possible team policy prevents a fully strict, unequivocal match to the 'no additional explanation warranted' rubric language."
        },
        {
          "name": "skill-invocation requires defend-the-di…",
          "passed": false,
          "score": 0,
          "evidence": "The following required skills were not called: defend-the-diff\nNo disallowed skills were called"
        },
        {
          "name": "diff-empty",
          "passed": true,
          "score": 1,
          "evidence": "Workspace diff is empty"
        }
      ]
    },
    {
      "evalName": "defend-the-diff",
      "stimulus": "defend-the-diff--documentation-only-change",
      "passed": false,
      "score": 0.5833333333333334,
      "durationMs": 66301,
      "metrics": {
        "tokens": 54486,
        "turns": 4,
        "tool_calls": 6,
        "wall_time_ms": 66301
      },
      "graders": [
        {
          "name": "prompt",
          "passed": false,
          "score": 0.75,
          "evidence": "Strong evaluation overall: it correctly classifies the patch as a harmless documentation typo fix, explains why it is defensible, and avoids speculative noise. The only minor shortfall is a small hedge suggesting a brief rationale note, which keeps it just shy of a perfectly strict 'nothing additional warranted' conclusion."
        },
        {
          "name": "skill-invocation requires defend-the-di…",
          "passed": false,
          "score": 0,
          "evidence": "The following required skills were not called: defend-the-diff\nNo disallowed skills were called"
        },
        {
          "name": "diff-empty",
          "passed": true,
          "score": 1,
          "evidence": "Workspace diff is empty"
        }
      ]
    },
    {
      "evalName": "defend-the-diff",
      "stimulus": "defend-the-diff--documentation-only-change",
      "passed": false,
      "score": 0.5833333333333334,
      "durationMs": 73651,
      "metrics": {
        "tokens": 42812,
        "turns": 3,
        "tool_calls": 5,
        "wall_time_ms": 73651
      },
      "graders": [
        {
          "name": "prompt",
          "passed": false,
          "score": 0.75,
          "evidence": "A solid, concise review that correctly classifies the patch as documentation-only and defensible, with no unnecessary speculation. Minor deduction for not explicitly naming tests/refactoring/comments when concluding no further follow-up is needed."
        },
        {
          "name": "skill-invocation requires defend-the-di…",
          "passed": false,
          "score": 0,
          "evidence": "The following required skills were not called: defend-the-diff\nNo disallowed skills were called"
        },
        {
          "name": "diff-empty",
          "passed": true,
          "score": 1,
          "evidence": "Workspace diff is empty"
        }
      ]
    },
    {
      "evalName": "defend-the-diff",
      "stimulus": "defend-the-diff--pagination-change",
      "passed": false,
      "score": 0.16666666666666666,
      "durationMs": 90128,
      "metrics": {
        "tokens": 115611,
        "turns": 8,
        "tool_calls": 10,
        "wall_time_ms": 90128
      },
      "graders": [
        {
          "name": "prompt",
          "passed": false,
          "score": 0.5,
          "evidence": "Technically, the analysis is strong on pagination correctness, slice semantics, and test-gap identification, and it correctly avoids making edits without approval. However, it misses the required multi-role/second-pass classification and role-context/fallback process criteria entirely. So the submission is partially successful but not fully compliant with the full rubric."
        },
        {
          "name": "skill-invocation requires defend-the-di…",
          "passed": false,
          "score": 0,
          "evidence": "The following required skills were not called: defend-the-diff\nNo disallowed skills were called"
        },
        {
          "name": "diff-empty",
          "passed": false,
          "score": 0,
          "evidence": "Workspace diff is not empty — the stimulus changed the workspace"
        }
      ]
    },
    {
      "evalName": "defend-the-diff",
      "stimulus": "defend-the-diff--pagination-change",
      "passed": false,
      "score": 0.08333333333333333,
      "durationMs": 97988,
      "metrics": {
        "tokens": 89662,
        "turns": 6,
        "tool_calls": 8,
        "wall_time_ms": 97988
      },
      "graders": [
        {
          "name": "prompt",
          "passed": false,
          "score": 0.25,
          "evidence": "Technically, the core pagination analysis is strong and accurate (off-by-one explanation and missing content-assertion tests were correctly identified). However, the response misses major required process elements in the rubric—especially the required questioner/defender/judge second-pass classifications and role-context workflow expectations. Because those rubric items are entirely absent, the overall performance is below acceptable despite correct technical conclusions."
        },
        {
          "name": "skill-invocation requires defend-the-di…",
          "passed": false,
          "score": 0,
          "evidence": "The following required skills were not called: defend-the-diff\nNo disallowed skills were called"
        },
        {
          "name": "diff-empty",
          "passed": false,
          "score": 0,
          "evidence": "Workspace diff is not empty — the stimulus changed the workspace"
        }
      ]
    },
    {
      "evalName": "defend-the-diff",
      "stimulus": "defend-the-diff--pagination-change",
      "passed": false,
      "score": 0.08333333333333333,
      "durationMs": 111060,
      "metrics": {
        "tokens": 156602,
        "turns": 10,
        "tool_calls": 14,
        "wall_time_ms": 111060
      },
      "graders": [
        {